[{"id":281720,"name":"Restored Chopper","quality":2,"itemLevel":1,"requiredLevel":1,"inventoryType":13,"itemClass":2,"itemSubclass":0,"stats":{"pending":true,"reason":"This build stores stat allocations, not amounts. The client works amounts out from item level and quality; that formula is not verified yet."},"statAllocations":[],"itemSetId":0,"allowableClassMask":-1,"provenance":{"product":"wow_classic_beta","build":"1.60.1.70094","table":"ItemSparse","rowId":281720,"sourceSha256":"192f24313ec18d880ac32dfd51bd6bcbe387618dd34195121460e7e2a8c8f33b"}},{"id":281721,"name":"Restored Cleaver","quality":2,"itemLevel":1,"requiredLevel":1,"inventoryType":17,"itemClass":2,"itemSubclass":1,"stats":{"pending":true,"reason":"This build stores stat allocations, not amounts. The client works amounts out from item level and quality; that formula is not verified yet."},"statAllocations":[],"itemSetId":0,"allowableClassMask":-1,"provenance":{"product":"wow_classic_beta","build":"1.60.1.70094","table":"ItemSparse","rowId":281721,"sourceSha256":"192f24313ec18d880ac32dfd51bd6bcbe387618dd34195121460e7e2a8c8f33b"}},{"id":281722,"name":"Restored Dagger","quality":2,"itemLevel":1,"requiredLevel":1,"inventoryType":13,"itemClass":2,"itemSubclass":15,"stats":{"pending":true,"reason":"This build stores stat allocations, not amounts. The client works amounts out from item level and quality; that formula is not verified yet."},"statAllocations":[],"itemSetId":0,"allowableClassMask":-1,"provenance":{"product":"wow_classic_beta","build":"1.60.1.70094","table":"ItemSparse","rowId":281722,"sourceSha256":"192f24313ec18d880ac32dfd51bd6bcbe387618dd34195121460e7e2a8c8f33b"}},{"id":281723,"name":"Restored Basher","quality":2,"itemLevel":1,"requiredLevel":1,"inventoryType":13,"itemClass":2,"itemSubclass":4,"stats":{"pending":true,"reason":"This build stores stat allocations, not amounts. The client works amounts out from item level and quality; that formula is not verified yet."},"statAllocations":[],"itemSetId":0,"allowableClassMask":-1,"provenance":{"product":"wow_classic_beta","build":"1.60.1.70094","table":"ItemSparse","rowId":281723,"sourceSha256":"192f24313ec18d880ac32dfd51bd6bcbe387618dd34195121460e7e2a8c8f33b"}},{"id":281724,"name":"Restored Smasher","quality":2,"itemLevel":1,"requiredLevel":1,"inventoryType":17,"itemClass":2,"itemSubclass":5,"stats":{"pending":true,"reason":"This build stores stat allocations, not amounts. The client works amounts out from item level and quality; that formula is not verified yet."},"statAllocations":[],"itemSetId":0,"allowableClassMask":-1,"provenance":{"product":"wow_classic_beta","build":"1.60.1.70094","table":"ItemSparse","rowId":281724,"sourceSha256":"192f24313ec18d880ac32dfd51bd6bcbe387618dd34195121460e7e2a8c8f33b"}},{"id":281725,"name":"Restored Spear","quality":2,"itemLevel":1,"requiredLevel":1,"inventoryType":17,"itemClass":2,"itemSubclass":6,"stats":{"pending":true,"reason":"This build stores stat allocations, not amounts. The client works amounts out from item level and quality; that formula is not verified yet."},"statAllocations":[],"itemSetId":0,"allowableClassMask":-1,"provenance":{"product":"wow_classic_beta","build":"1.60.1.70094","table":"ItemSparse","rowId":281725,"sourceSha256":"192f24313ec18d880ac32dfd51bd6bcbe387618dd34195121460e7e2a8c8f33b"}},{"id":281727,"name":"Restored Greatstaff","quality":2,"itemLevel":1,"requiredLevel":1,"inventoryType":17,"itemClass":2,"itemSubclass":10,"stats":{"pending":true,"reason":"This build stores stat allocations, not amounts. The client works amounts out from item level and quality; that formula is not verified yet."},"statAllocations":[],"itemSetId":0,"allowableClassMask":-1,"provenance":{"product":"wow_classic_beta","build":"1.60.1.70094","table":"ItemSparse","rowId":281727,"sourceSha256":"192f24313ec18d880ac32dfd51bd6bcbe387618dd34195121460e7e2a8c8f33b"}},{"id":281728,"name":"Restored Shortsword","quality":2,"itemLevel":1,"requiredLevel":1,"inventoryType":13,"itemClass":2,"itemSubclass":7,"stats":{"pending":true,"reason":"This build stores stat allocations, not amounts. The client works amounts out from item level and quality; that formula is not verified yet."},"statAllocations":[],"itemSetId":0,"allowableClassMask":-1,"provenance":{"product":"wow_classic_beta","build":"1.60.1.70094","table":"ItemSparse","rowId":281728,"sourceSha256":"192f24313ec18d880ac32dfd51bd6bcbe387618dd34195121460e7e2a8c8f33b"}},{"id":281729,"name":"Restored Longsword","quality":2,"itemLevel":1,"requiredLevel":1,"inventoryType":17,"itemClass":2,"itemSubclass":8,"stats":{"pending":true,"reason":"This build stores stat allocations, not amounts. The client works amounts out from item level and quality; that formula is not verified yet."},"statAllocations":[],"itemSetId":0,"allowableClassMask":-1,"provenance":{"product":"wow_classic_beta","build":"1.60.1.70094","table":"ItemSparse","rowId":281729,"sourceSha256":"192f24313ec18d880ac32dfd51bd6bcbe387618dd34195121460e7e2a8c8f33b"}},{"id":281730,"name":"Restored Bauble","quality":2,"itemLevel":1,"requiredLevel":1,"inventoryType":23,"itemClass":4,"itemSubclass":0,"stats":{"pending":true,"reason":"This build stores stat allocations, not amounts. The client works amounts out from item level and quality; that formula is not verified yet."},"statAllocations":[],"itemSetId":0,"allowableClassMask":-1,"provenance":{"product":"wow_classic_beta","build":"1.60.1.70094","table":"ItemSparse","rowId":281730,"sourceSha256":"192f24313ec18d880ac32dfd51bd6bcbe387618dd34195121460e7e2a8c8f33b"}},{"id":281731,"name":"Restored Buckler","quality":2,"itemLevel":1,"requiredLevel":1,"inventoryType":14,"itemClass":4,"itemSubclass":6,"stats":{"pending":true,"reason":"This build stores stat allocations, not amounts. The client works amounts out from item level and quality; that formula is not verified yet."},"statAllocations":[],"itemSetId":0,"allowableClassMask":-1,"provenance":{"product":"wow_classic_beta","build":"1.60.1.70094","table":"ItemSparse","rowId":281731,"sourceSha256":"192f24313ec18d880ac32dfd51bd6bcbe387618dd34195121460e7e2a8c8f33b"}},{"id":281732,"name":"Restored Bow","quality":2,"itemLevel":1,"requiredLevel":1,"inventoryType":15,"itemClass":2,"itemSubclass":2,"stats":{"pending":true,"reason":"This build stores stat allocations, not amounts. The client works amounts out from item level and quality; that formula is not verified yet."},"statAllocations":[],"itemSetId":0,"allowableClassMask":-1,"provenance":{"product":"wow_classic_beta","build":"1.60.1.70094","table":"ItemSparse","rowId":281732,"sourceSha256":"192f24313ec18d880ac32dfd51bd6bcbe387618dd34195121460e7e2a8c8f33b"}},{"id":281733,"name":"Restored Wand","quality":2,"itemLevel":1,"requiredLevel":1,"inventoryType":26,"itemClass":2,"itemSubclass":19,"stats":{"pending":true,"reason":"This build stores stat allocations, not amounts. The client works amounts out from item level and quality; that formula is not verified yet."},"statAllocations":[],"itemSetId":0,"allowableClassMask":-1,"provenance":{"product":"wow_classic_beta","build":"1.60.1.70094","table":"ItemSparse","rowId":281733,"sourceSha256":"192f24313ec18d880ac32dfd51bd6bcbe387618dd34195121460e7e2a8c8f33b"}},{"id":281927,"name":"Boulderheart Band","quality":2,"itemLevel":27,"requiredLevel":22,"inventoryType":11,"itemClass":4,"itemSubclass":0,"stats":{"pending":true,"reason":"This build stores stat allocations, not amounts. The client works amounts out from item level and quality; that formula is not verified yet."},"statAllocations":[{"statTypeId":7,"allocation":3600},{"statTypeId":4,"allocation":8400}],"itemSetId":0,"allowableClassMask":-1,"provenance":{"product":"wow_classic_beta","build":"1.60.1.70094","table":"ItemSparse","rowId":281927,"sourceSha256":"192f24313ec18d880ac32dfd51bd6bcbe387618dd34195121460e7e2a8c8f33b"}},{"id":282015,"name":"Restored Small Brown Pouch","quality":1,"itemLevel":5,"requiredLevel":0,"inventoryType":18,"itemClass":1,"itemSubclass":0,"stats":{"pending":true,"reason":"This build stores stat allocations, not amounts. The client works amounts out from item level and quality; that formula is not verified yet."},"statAllocations":[],"itemSetId":0,"allowableClassMask":-1,"provenance":{"product":"wow_classic_beta","build":"1.60.1.70094","table":"ItemSparse","rowId":282015,"sourceSha256":"192f24313ec18d880ac32dfd51bd6bcbe387618dd34195121460e7e2a8c8f33b"}},{"id":282016,"name":"Restored Brown Leather Satchel","quality":1,"itemLevel":15,"requiredLevel":0,"inventoryType":18,"itemClass":1,"itemSubclass":0,"stats":{"pending":true,"reason":"This build stores stat allocations, not amounts. The client works amounts out from item level and quality; that formula is not verified yet."},"statAllocations":[],"itemSetId":0,"allowableClassMask":-1,"provenance":{"product":"wow_classic_beta","build":"1.60.1.70094","table":"ItemSparse","rowId":282016,"sourceSha256":"192f24313ec18d880ac32dfd51bd6bcbe387618dd34195121460e7e2a8c8f33b"}},{"id":282017,"name":"Restored Heavy Brown Bag","quality":1,"itemLevel":25,"requiredLevel":0,"inventoryType":18,"itemClass":1,"itemSubclass":0,"stats":{"pending":true,"reason":"This build stores stat allocations, not amounts. The client works amounts out from item level and quality; that formula is not verified yet."},"statAllocations":[],"itemSetId":0,"allowableClassMask":-1,"provenance":{"product":"wow_classic_beta","build":"1.60.1.70094","table":"ItemSparse","rowId":282017,"sourceSha256":"192f24313ec18d880ac32dfd51bd6bcbe387618dd34195121460e7e2a8c8f33b"}},{"id":282026,"name":"Unyielding Battle Signet","quality":2,"itemLevel":58,"requiredLevel":53,"inventoryType":11,"itemClass":4,"itemSubclass":0,"stats":{"pending":true,"reason":"This build stores stat allocations, not amounts. The client works amounts out from item level and quality; that formula is not verified yet."},"statAllocations":[{"statTypeId":4,"allocation":2400},{"statTypeId":6,"allocation":2400},{"statTypeId":7,"allocation":8400}],"itemSetId":0,